{
  "$schema": "http://json-schema.org/draft-07/schema#",
  "title": "Achievement",
  "type": "object",
  "required": [
    "id",
    "name",
    "rule"
  ],
  "properties": {
    "id": {
      "type": "string"
    },
    "name": {
      "type": "string"
    },
    "rule": {
      "type": "string"
    },
    "grants_memory": {
      "type": [
        "string",
        "null"
      ]
    }
  },
  "additionalProperties": false
}